{
  "v": 1,
  "height": 1,
  "prev": "0000000000000000000000000000000000000000000",
  "hash": "0000000000000000000000000000000000000000000",
  "origin": "0000000000000000000000000000000000000000000",
  "commands": [
    {
      "seq": 1,
      "cmd": "data",
      "ns": "genesis:init",
      "d": ""
    }
  ],
  "votes": [
    {
      "origin": "0000000000000000000000000000000000000000000",
      "sig": "00000000000000000000000000000000000000000000000000000000000000000000000000000000000000"
    }
  ]
}
